{
  "schema_version": "1.0",
  "experiment_id": "EXP-MAP-A03",
  "registry_bindings": {
    "experiment": "3b0bb9c77c80a19a0fca69103f084bb9368593d56d1e3bf037775fb74732794e",
    "dataset": "2fe4ab7f5763f39c6cde8392c3f7d8ff1a565e4664ce6e192640b99f3fe146d7",
    "provenance": "051578934af53b190605257f49da77ff83683638b12e9d176c74b7b8cc4a0aa1",
    "parameter": "58b2aac41dc18d3ce8a7729ef610d11c05d089846a34ef447b337bc45589da76",
    "null": "396bfcc6d124cfea5a8cff8df3f1605aa6f3be177afd2202915ad5c3c844950a"
  },
  "command": [
    "python",
    "-m",
    "src.experiments.exp_map_a03",
    "--input",
    "{repo_root}/data/ecdata/allcurves/allcurves.00000-09999",
    "--output-dir",
    "{run_dir}"
  ],
  "dataset_inputs": [
    {
      "path": "data/ecdata/allcurves/allcurves.00000-09999",
      "sha256": "259f3846329395b371e8079c77a6f1097adaebc98a054974573e241416efa968"
    }
  ],
  "code_inputs": [
    {
      "path": "src/data/cremona_ecdata.py",
      "sha256": "7e3f79a9fd7ddf6af9c95d5dd4637015cc871b628ec6bf78f9060febc3067b97"
    },
    {
      "path": "src/experiments/exp_map_a01.py",
      "sha256": "d3e1b844cfc7e0ed99efbddcfa69646f31b5b90b72a96840af3d106f386c75ab"
    },
    {
      "path": "src/experiments/exp_map_a03.py",
      "sha256": "f27a48a1c1c51851fb6838010a35d3a99f4201bd173c7d51437d2d53af8e5333"
    }
  ],
  "config": {
    "schema_version": "1.0",
    "protocol_version": "EXP-MAP-A03-prereg-v1",
    "experiment_id": "EXP-MAP-A03",
    "qualified_experiment_id": "REPO-CSV-v0.2:EXP-MAP-A03",
    "claim_ids": [
      "CLAIM-ACSC-002"
    ],
    "dataset_id": "DATA-ARITHMETIC",
    "parameter_set_id": "PAR-MAP-003",
    "null_id": "NULL-MAP-003",
    "scientific_scope": "internal rank-coherence test of a BSD-independent j-invariant/conductor graph; NO cosmological data or physical support",
    "input": {
      "manifest": "preregistrations/EXP-MAP-A03/dataset_manifest.json",
      "source": "data/ecdata/allcurves/allcurves.00000-09999",
      "source_format": "ecdata-allcurves-v1",
      "source_schema": [
        "conductor",
        "isogeny",
        "curve_number",
        "a_invariants",
        "rank",
        "torsion_order"
      ],
      "source_sha256": "259f3846329395b371e8079c77a6f1097adaebc98a054974573e241416efa968",
      "source_rows": 64687,
      "source_gitlink": "25cec5ecfec8b9f016eb1631ac633194c2bed39f",
      "representative_policy": "curve_number_equals_1_per_isogeny_class",
      "representative_rows": 38042,
      "j_zero_exclusions": 106,
      "analysis_rows": 37936,
      "analysis_selection": "curve_number_equals_1_per_isogeny_class_then_exclude_exact_j_equals_zero_before_rank_use",
      "sort": "conductor_ascending_then_ascii_label",
      "nonfinite_policy": "fail",
      "duplicate_labels": "fail",
      "singular_curves": "fail",
      "post_hoc_filtering": false
    },
    "arithmetic": {
      "b2": "a1*a1+4*a2",
      "b4": "a1*a3+2*a4",
      "b6": "a3*a3+4*a6",
      "b8": "a1*a1*a6+4*a2*a6-a1*a3*a4+a2*a3*a3-a4*a4",
      "c4": "b2*b2-24*b4",
      "delta": "-b2*b2*b8-8*b4*b4*b4-27*b6*b6+9*b2*b4*b6",
      "j": "c4^3/delta",
      "exact_until_logs": true
    },
    "mapping": {
      "x": "ln(N)",
      "y": "3*ln(abs(c4))-ln(abs(delta))",
      "z": "0 if j>0 else pi if j<0",
      "logarithm": "natural",
      "complex_branch": "principal_negative_real_argument_plus_pi",
      "units": "dimensionless",
      "numeric_geometry": "IEEE-754-binary64",
      "normalization": "none",
      "clipping": false,
      "jitter": false,
      "fitting": false,
      "regulator_used": false,
      "rank_used_in_embedding": false,
      "j_zero_policy": "exclude_before_graph_and_before_rank_use; require exactly 106",
      "j_negative_policy": "principal complex logarithm with argument +pi"
    },
    "endpoint": {
      "name": "mcj_knn_rank_coherence",
      "k": 10,
      "metric": "euclidean_xyz_binary64",
      "neighbor_coordinates": [
        "x",
        "y",
        "z"
      ],
      "ties": "ascending squared_euclidean_distance_binary64 then ASCII_Cremona_label",
      "coordinate_duplicates": "retain_and_resolve_by_same_tie_rule",
      "self_neighbors": "exclude",
      "undirected_edges": "unique_sorted_pairs",
      "statistic": "T_obs = - mean_over_edges(abs(rank_i-rank_j))",
      "direction": "greater_is_more_rank_coherence"
    },
    "null": {
      "name": "conductor_decile_stratified_rank_permutation_fixed_graph",
      "strata": 10,
      "stratification": "accepted rows sorted by (conductor,label_ASCII); stratum=floor(10*i/n), i zero-based",
      "preserved": [
        "curve_identity",
        "conductor",
        "c4",
        "delta",
        "j_status",
        "embedding",
        "graph_edges",
        "rank_multiset_within_each_stratum"
      ],
      "seed": 4103,
      "algorithm": "splitmix64-fisher-yates-v1",
      "splitmix64": {
        "word_bits": 64,
        "increment_hex": "0x9E3779B97F4A7C15",
        "multiplier_1_hex": "0xBF58476D1CE4E5B9",
        "multiplier_2_hex": "0x94D049BB133111EB",
        "randbelow": "rejection_below_floor_2^64_over_upper_times_upper_then_mod_upper",
        "fisher_yates": "for i=size-1 down to 1 draw j=randbelow(i+1) and swap i,j"
      },
      "draw_order": "b=1..999; within each b strata 0..9; original observed ranks permuted independently within each stratum; one continuing RNG stream; no reset between strata or draws",
      "realizations": 999,
      "rerolls": false
    },
    "inference": {
      "alpha": 0.005,
      "sidedness": "one_sided_greater",
      "pvalue": "(1 + count(T_b>=T_obs))/(999+1)",
      "decision": "reject_null_iff_p_value_less_than_alpha",
      "primary_endpoint_count": 1,
      "multiple_testing": "none_single_endpoint",
      "report_effect": "T_obs - median(T_null)",
      "interpretation": "conditional internal arithmetic evidence only; no cosmological or physical-support inference"
    },
    "outputs": [
      "summary.json",
      "observed_mcj_projection.csv",
      "null_statistics.csv",
      "exclusions_j_zero.csv"
    ],
    "controls": {
      "controlled_execution_eligible": false,
      "controlled_support_eligible": false,
      "physical_support_eligible": false,
      "no_run_without_separate_activation": true
    }
  },
  "config_files": [
    {
      "path": "preregistrations/EXP-MAP-A03/config.json",
      "sha256": "ce082118d964fdb8ad2b3d667466066a6acebff2df223e53b79f84381abedffa"
    },
    {
      "path": "preregistrations/EXP-MAP-A03/dataset_manifest.json",
      "sha256": "6a7188f362422c6468a85d7011219c168df394c9d75a51bfe05db461eeeaf630"
    },
    {
      "path": "preregistrations/EXP-MAP-A03/protocol.md",
      "sha256": "dbe32ebd45f5037b2c5b4dfd452c09e2bb4f617a68a112f3caf9257db2d1356d"
    }
  ],
  "rng_seeds": {
    "rank_permutation": 4103
  },
  "output_paths": [
    "summary.json",
    "observed_mcj_projection.csv",
    "null_statistics.csv",
    "exclusions_j_zero.csv"
  ],
  "timeout_seconds": 3600,
  "container_image_digest": null
}
